{
  "epic": "proj-12",
  "profile": "backend",
  "session": "session_example",
  "branch": "claude/proj-12-slug",
  "status": "working",
  "base": "4b825dc642cb6eb9a060e54bf8d69288fbee4904",
  "children": [
    {
      "id": "proj-12.1",
      "outcome": "open"
    },
    {
      "id": "proj-12.2",
      "outcome": "deferred",
      "note": "needs the owner's decision on retention"
    },
    {
      "id": "proj-12.3",
      "outcome": "reparented",
      "to": "proj-14"
    }
  ],
  "runs": [
    "run-proj-12-1"
  ]
}
