{
  "epic": "wc-3",
  "profile": "backend",
  "session": "cr-worker:backend",
  "branch": "claude/wc-3-count-words",
  "status": "working",
  "base": "6997cfe1b1f911afcfde1f9ac28d98ec86761256",
  "children": [
    {
      "id": "wc-3.1",
      "outcome": "open"
    },
    {
      "id": "wc-3.2",
      "outcome": "open"
    }
  ],
  "questions": [
    {
      "text": "wc-3.2: awk splits words on ASCII blanks only. Should wordcount split on every Unicode space (my recommendation), keep ASCII and document it, or use a segmenter library (a first dependency)?",
      "blocking": false
    }
  ]
}
